Cost Center,Group Name Line 1,Group Name Line 2,Group Name Line 3,Address Line 4,"City, State , Zip Line 5",
D100 - UNITE HERE,San Diego UNITE HERE Trust Funds,,,"3737 CAMINO DEL RIO SOUTH, SUITE 300","SAN DIEGO, CA 92108",
D200 - San Diego Theatrical,SAN DIEGO THEATRICAL TRUST FUNDS,,,"3737 CAMINO DEL RIO SOUTH, SUITE 300","SAN DIEGO, CA 92108",
D300 - San Diego Cement Masons,SAN DIEGO CEMENT MASONS TRUST FUNDS,,,"3737 CAMINO DEL RIO SOUTH, SUITE 300","SAN DIEGO, CA 92108",
L100 - Tile 18,TILE  INDUSTRY TRUST FUNDS ,LOCAL # 18,,P.O. BOX 2559,"WEST COVINA, CA 91793",
L200 - Brick Masons Local 4,BRICK MASONS TRUST FUNDS,,,P.O. BOX 430,"WEST COVINA, CA 91793",
L300 - IBEW Local 1710,LOCAL UNION 1710 IBEW,TRUST FUNDS,,P.O. BOX 2559,"WEST COVINA, CA 91793",
L400 - SoCal Soft Drink Industry,SOUTHERN CALIFORNIA SOFT DRINK,INDUSTRY & TEAMSTERS HEALTH,AND WELFARE TRUST FUND,P.O. BOX 1318,"WEST COVINA, CA 91793",
L500 - Teamsters & Food,TEAMSTERS AND FOOD EMPLOYERS,SECURITY TRUST FUND,,P.O. BOX 2340,"WEST COVINA, CA 91793",
L600 - Producers Health TBENefits Plan,PRODUCERS' HEALTH,TBENEFITS PLAN,,P.O. BOX 2340,"WEST COVINA, CA 91793",
P100 - Industrial Carpenters,INDUSTRIAL CARPENTERS TRUST FUNDS,,,P.O. BOX 237,"SAN RAMON, CA 94583",
P300 - IBEW Local 595,IBEW LOCAL 595 TRUST FUNDS,,,P.O. BOX 3420,"SAN RAMON, CA 94583",
P400 - Stationary Engineers Local 39,STATIONARY ENGINEERS LOCAL 39,TRUST FUNDS,,P.O. BOX 1737,"SAN RAMON, CA 94583",
P700 - IBEW Western Utilities,IBEW/WESTERN UTILITIES,HEALTH & WELFARE TRUST FUND,,P.O. BOX 215,"SAN RAMON, CA 94583",
P800 - Utah Pipe Trades,UTAH PIPE TRADES TRUST FUND,,,P.O. BOX 1975,"SAN RAMON, CA 94583",
Q100 - MFOW,MFOW MONEY PURCHASE PENSION PLAN,,,P.O. BOX 154,"SAN RAMON, CA 94583",
Q200 - IBEW Local 1245,IBEW LOCAL 1245,MONEY PURCHASE PENSION PLAN,,P.O. BOX 154,"SAN RAMON, CA 94583",
Q300 - IBEW Local 684,IBEW LOCAL NO. 684 TRUST FUNDS,,,P.O. BOX 1975,"SAN RAMON, CA 94583",
Q400 - Contra Costa County Electrical Workers Local 302,CONTRA COSTA COUNTY ELECTRICAL WORKERS,TRUST FUNDS,,P.O. BOX 237,"SAN RAMON, CA 94583",
Q500 - BEW Local 234,IBEW LOCAL 234  HEALTH AND WELFARE PLAN,,,P.O. BOX 670,"SAN JOSE, CA 95109",
Q700 - Lathers 88,LATHERS LOCAL #88L PENSION PLAN,LATHERS LOCAL #88L MONEY PURCHASE PENSION PLAN,,P.O. BOX 215,"SAN RAMON, CA 94583",
S100 - Sheet Metal Workers Local 104,SHEET METAL WORKERS LOCAL 104,TBENEFIT FUNDS,,P.O. BOX 1917,"SAN RAMON, CA 94583",
S100/S200 - Sheet Metal Workers of Northern California,SHEET METAL WORKERS LOCAL 162,TBENEFIT FUNDS,,P.O. BOX 1677,"SAN RAMON, CA 94583",
S200 - Sheet Metal Workers Local 162,SHEET METAL WORKERS PENSION PLAN,OF NORTHERN CALIFORNIA TRUST FUND,,P.O. BOX 1917,"SAN RAMON, CA 94583",
S300 - UA Local 393,U.A. LOCAL 393,TBENEFIT FUNDS,,P.O. BOX 2460,"SAN JOSE, CA 95109-2460",
S500 - Solano/Napa Electrical Local 180,SOLANO AND NAPA COUNTIES,ELECTRICAL WORKERS TBENEFIT FUNDS,,P.O. BOX 1306,"SAN RAMON, CA 94583",
S600 - Pipe Trades District Counsel 36,PIPE TRADES DC #36 TRUST FUNDS,,,P.O. BOX 90640,"SAN JOSE, CA 95109",
S800 - Clerks and Lumber Handlers,THE KEN LUSBY CLERKS AND,LUMBER HANDLERS PENSION FUND,,P.O. BOX 2305,"SAN RAMON, CA 94583",
S900 - Livermore Teachers,LIVERMORE VALLEY,JOINT UNIFIED RETIRED EMPLOYEE,HEALTH TBENEFIT FUND,P.O. BOX 2305,"SAN RAMON, CA 94583",
V100 - Cement Masons Local 797,CEMENT MASONS AND PLASTERERS,LOCAL 797 TBENEFIT FUNDS,,P.O. BOX 32229 ,"LAS VEGAS, NV 89173-2229",
V200 - Teamsters Local 631,TEAMSTERS LOCAL 631,JOINT TRUST FUNDS,,P.O. BOX 31900,"LAS VEGAS, NV 89173",
V300 - IBEW Local 357,ELECTRICAL WORKERS LOCAL 357 TRUST FUNDS,,,P.O. BOX 30850,"LAS VEGAS, NV 89173",
